{
  "metadata": {
    "project_id": "DesignSpec_Example",
    "agent": "design",
    "task_id": "design-DesignSpec_Example",
    "timestamp": "2026-07-23T09:30:00+08:00",
    "schema_version": "1.0",
    "status": "COMPLETED",
    "quality": { "confidence": 0.85, "quality_score": 85, "validation_passed": true }
  },
  "version": "v1",
  "design_goal": "为三口之家打造北欧风格温馨住宅，满足居家办公与儿童活动需求，强调收纳与采光。",
  "style": {
    "labels": ["Nordic"],
    "description": "浅色木饰面 + 中性灰，强调自然采光与极简收纳"
  },
  "budget": {
    "level": "MEDIUM",
    "currency": "CNY",
    "total_estimate": 250000,
    "allocation": [
      { "category": "硬装", "ratio": 0.45, "note": "墙面/地面/顶面基础" },
      { "category": "定制柜体", "ratio": 0.2, "note": "收纳为主" },
      { "category": "软装家具", "ratio": 0.2 },
      { "category": "电器设备", "ratio": 0.15 }
    ]
  },
  "family": {
    "adults": 2,
    "children": 1,
    "elders": 0,
    "pets": [],
    "work_from_home": true,
    "accessibility": false,
    "notes": "有学龄儿童，需独立学习区"
  },
  "rooms": [
    { "room_id": "R001", "name": "客厅", "function": "会客与家庭活动", "priority": "high", "notes": "与餐厅连通" },
    { "room_id": "R002", "name": "主卧", "function": "主卧", "priority": "high", "notes": "含步入式衣柜" },
    { "room_id": "R003", "name": "次卧", "function": "儿童房/客房", "priority": "medium", "notes": "学习区" },
    { "room_id": "R004", "name": "厨房", "function": "烹饪与备餐", "priority": "medium" },
    { "room_id": "R005", "name": "卫生间", "function": "卫浴", "priority": "medium", "notes": "干湿分离" }
  ],
  "constraints": {
    "non_removable_walls": ["W01", "W02", "W03", "W04"],
    "load_bearing_walls": ["W01", "W02", "W03", "W04"],
    "pipe_shafts": [],
    "windows": ["WIN01"],
    "beams": [],
    "columns": [],
    "balconies": [],
    "equipment_platforms": [],
    "ceiling_height_mm": 2800,
    "area_m2": 20.0,
    "orientation": "南",
    "notes": "管井/梁/柱/阳台/设备平台 DWG 未含，需现场或结构图补充"
  },
  "preferences": {
    "colors": ["浅灰", "原木色", "白色"],
    "lighting_preference": "natural",
    "accessibility": false,
    "notes": "偏好明亮柔和的自然光"
  },
  "materials": [
    { "category": "地面", "spec": "木地板", "brand_recommended": false },
    { "category": "墙面", "spec": "乳胶漆", "brand_recommended": false },
    { "category": "厨房墙面", "spec": "岩板", "brand_recommended": false }
  ],
  "lighting": {
    "natural_light": "客厅南向大窗引入自然光",
    "artificial_light": "无主灯设计，重点照明 + 氛围灯带",
    "notes": "阅读区补充护眼台灯"
  },
  "storage": {
    "strategy": "全屋定制柜体，玄关/客厅/卧室系统收纳",
    "capacity_notes": "儿童玩具与书籍集中收纳"
  },
  "special_requirements": ["居家办公", "儿童活动"]
}
